,post_id,post_title,post_url,post_text,post_score,num_comments,post_create_date,post_flair,movie_searched
0,uwfujk,Marvel Studios' Thor: Love and Thunder | Official Trailer,https://www.youtube.com/watch?v=Go8nTmfrQd8,,22418.0,3139.0,1653356821.0,Trailer,"Love, Rosie"
1,2hwemn,Taken 3 Trailer.,https://www.youtube.com/watch?v=JuU0M2xBasc,,2382.0,897.0,1412093018.0,Trailers,Taken 3
2,8r2og8,Unfriended: Dark Web - Official Trailer,https://youtu.be/4DJAWGXkvq8,,154.0,152.0,1528989622.0,Trailers,Unfriended
3,1jh98x,Seventh Son trailer (The Dude vs Witches),http://www.youtube.com/watch?v=OmgMjiV9awM,,72.0,48.0,1375339227.0,,Seventh Son
4,2p6dk0,The Loft - Official Trailer,https://www.youtube.com/watch?v=3rwK2dDd3rg,,0.0,2.0,1418484334.0,Media,The Loft
5,d0htmy,Wrinkles The Clown - Official Trailer,https://www.youtube.com/watch?v=sSOt0Ks97_E,,453.0,74.0,1567782141.0,,Clown
6,yk3qct,Avatar: The Way of Water | Official Trailer,https://www.youtube.com/watch?v=d9MyW72ELq0,,17810.0,4227.0,1667391579.0,Trailer,The Water Diviner
7,v7p2xw,Black Adam - Official Trailer,https://www.youtube.com/watch?v=VCvwy4dFUmw,,25056.0,4906.0,1654693194.0,Trailer,Black Sea
8,mu0n2h,Marvel Studios' Shang-Chi and the Legend of the Ten Rings | Teaser Trailer,https://www.youtube.com/watch?v=giWIr7U1deA,,22050.0,3740.0,1618839020.0,Trailers,Tinker Bell and the Legend of the NeverBeast
9,2luwn0,New 'Testament Of Youth' Trailer,https://www.youtube.com/watch?v=vKt_G23eUJc,,0.0,0.0,1415627557.0,Media,Testament of Youth
10,18iv9b1,Movies about acting? (Like Clouds of Sils Maria or May December.) #metacinema,https://www.reddit.com/r/movies/comments/18iv9b1/movies_about_acting_like_clouds_of_sils_maria_or/,"Howdy! I’m currently intrigued by metacinema and looking for movies that specifically are about actors acting and finding their process for a role.

Two recent examples are Clouds of Sils of Maria (2014) and May December (2024).

Both feature characters who are actors preparing for roles and working out how to inhabit their characters.

Do you happen to know of other films like this?

Merci in advance!",1.0,11.0,1702627926.0,Question,Clouds of Sils Maria
11,xf6weh,There's a trailer playing Johnny Cash Folsom Prison Blues for a 2022/2023 movie - any idea which one it is?,https://www.reddit.com/r/movies/comments/xf6weh/theres_a_trailer_playing_johnny_cash_folsom/,"I saw a trailer recently… it was this year (or 2021) and had the song Folsom Prison Blues which is going viral right now. Can’t remember where and it’s driving me nuts! Wrath Of Man with Jason Stathem also featured it but that’s not the one. Someone… help. 
If it helps it was a pretty major movie or something with a cult following. Think Marvel type big…",169.0,379.0,1663273358.0,Trailer,Playing It Cool
12,36ryzl,Cooties Trailer (HD) ... Elementary school children become zombies after eating infected chicken nuggets,https://www.youtube.com/watch?v=2l0dbvkCV5w?r,,3674.0,326.0,1432229087.0,Trailers,Cooties
13,1xa9wn,"""ZOMBEAVERS"" Trailer",http://www.youtube.com/watch?v=hSBUF15zny8,,5.0,2.0,1391793657.0,,Zombeavers
14,ha80ju,Palm Springs - Trailer (Official) • A Hulu Original Film,https://youtu.be/CpBLtXduh_k,,2427.0,232.0,1592327101.0,Trailers,Spring
15,zojo51,What is the best trailer you have ever seen?,https://www.reddit.com/r/movies/comments/zojo51/what_is_the_best_trailer_you_have_ever_seen/,"What is a trailer that got you instantly interested and wanting to see a movie? What trailer had captivating music and editing that locked your atenttion?

For me its easily the trailer for The Handmaiden. It actually should win some award just for the trailer. It instantly hooks you with that hypnotic beat that doesnt relent at all. The quick provocative clips get you even more interested in the story and characters.
And whats even more incredible is that it tells you nothing about the story. It avoids the biggest problem with modern trailers. Giving up too much of the plot before you even see it. After watching the movie and returning to the trailer was even more incredible. I learned nothing from the trailer. No character or plot details were spoiled.",5430.0,5236.0,1671320046.0,Discussion,Everly
16,2exubk,"Trailer forTHE REWRITE (2014) - Hugh Grant, Marisa Tomei, J. K. Simmons",https://www.youtube.com/watch?v=cL-tP03XoH4,,0.0,1.0,1409336504.0,Trailers,The Rewrite
17,75dxyb,Star Wars: The Last Jedi Official Trailer,https://www.youtube.com/watch?v=Q0CbN8sfihY,,49779.0,7080.0,1507600749.0,Trailers,Last Shift
18,2xxif9,New 'Avengers: Age of Ultron' trailer!,https://www.youtube.com/watch?v=kQVEC1YGLK4,,18839.0,5074.0,1425492810.0,Trailers,Avengers: Age of Ultron
19,30y0mv,'Mad Max: Fury Road' Final Theatrical Trailer,https://www.youtube.com/watch?v=hEJnMQG9ev8,,9996.0,2308.0,1427821214.0,Trailers,Mad Max: Fury Road
20,17rdja2,Inside Out 2 (2024) Official Trailer,https://www.youtube.com/watch?v=VWavstJydZU,,2509.0,714.0,1699538352.0,Trailer,Inside Out
21,7ibelg,'Jurassic World: Fallen Kingdom' - Official Trailer,https://www.youtube.com/watch?v=vn9mMeWcgoM,,29277.0,7087.0,1512697514.0,Trailers,Jurassic World
22,32fqqb,First Official Ant-Man Trailer,https://youtu.be/pWdKf3MneyI,,15479.0,3030.0,1428930016.0,Trailers,Ant-Man
23,390vcp,The Martian | Official Trailer [HD] | 20th Century FOX,https://www.youtube.com/watch?v=Ue4PCI0NamI,,27446.0,4520.0,1433768092.0,Spoilers,The Martian
24,3pfpp1,Star Wars: The Force Awakens Trailer #3,https://www.youtube.com/watch?v=sGbxmsDFVnE,,61892.0,13294.0,1445306924.0,Trailers,Star Wars: The Force Awakens
25,3mtw7m,The Revenant | Official Trailer [HD] | 20th Century FOX,https://www.youtube.com/watch?v=LoebZZ8K5N0,,9432.0,1358.0,1443532604.0,Trailers,The Revenant
26,3hmm61,'The Hateful Eight' Character Posters,http://imgur.com/a/wH9lH,,9491.0,850.0,1440014918.0,Poster,The Hateful Eight
27,4ajcqs,Honest Trailers - The Hunger Games: Mockingjay Part 2,https://www.youtube.com/watch?v=oqmSgcP83mg,,128.0,55.0,1458061499.0,Media,The Hunger Games: Mockingjay - Part 2
28,6hnk4e,'Fifty Shades of Grey' Director Sam Taylor-Johnson Regrets Making The Film,http://screenrant.com/fifty-shades-director-sam-taylor-johnson-regret-conflict/,,24767.0,2342.0,1497630063.0,News,Fifty Shades of Grey
29,2kdqba,"Poster for the newly titled 'Furious 7' (Fast & Furious 7), trailer hitting in seven days",http://imgur.com/2qQnoRK,,1098.0,327.0,1414342710.0,Media,Furious 7
30,2l7vpu,Minions - Official Trailer (HD) - Illumination,https://www.youtube.com/watch?feature=player_embedded&v=P9-FCC6I7u0,,631.0,144.0,1415065570.0,Media,Minions
31,3e66o3,'Spectre' Trailer #2,https://www.youtube.com/watch?v=LTDaET-JweU,,12765.0,2235.0,1437548149.0,Trailers,Spectre
32,3ee0hg,'Maze Runner: The Scorch Trials' Official Full-Length Trailer,https://www.youtube.com/watch?v=SDofO3P2HpE,,450.0,164.0,1437697810.0,Trailers,Maze Runner: The Scorch Trials
33,2p3755,Divergent Series: Insurgent Trailer,http://youtu.be/suZcGoRLXkU,,45.0,111.0,1418400926.0,Trailers,Insurgent
34,15h5o27,Uma Thurman stars opposite daughter Maya Hawke in trailer for crime thriller The Kill Room,https://ew.com/movies/the-kill-room-trailer-uma-thurman-maya-hawke,,7775.0,732.0,1691072630.0,Trailer,Room
35,3lxijm,"'The Big Short' - Official Trailer (starring Brad Pitt, Christian Bale, Ryan Gosling, Karen Gillan and Steve Carell)",https://www.youtube.com/watch?v=vgqG3ITMv1Q,,3287.0,588.0,1442926263.0,Trailers,The Big Short
36,300n0k,First full trailer for Mission Impossible 5: Rogue Nation,https://www.youtube.com/watch?v=gOW_azQbOjw,,6979.0,1876.0,1427122949.0,Trailers,Mission: Impossible - Rogue Nation
37,2orxen,San Andreas - Official Teaser Trailer [HD],https://www.youtube.com/watch?v=Bz9e0PGSDeU,,412.0,420.0,1418148272.0,Trailers,San Andreas
38,7kuksj,"First Trailer for 'Sicario 2: Soldado' - Starring Benicio Del Toro, Josh Brolin, and Jeffrey Donovan",https://www.youtube.com/watch?v=NyBgZzQT-NA,,6537.0,964.0,1513703061.0,Trailers,Sicario
39,32frcw,New Trailer for 'Terminator Genisys',https://www.youtube.com/watch?v=0V1tCzsgy44,,919.0,956.0,1428930370.0,Trailers,Terminator Genisys
40,3f1mah,"'Spotlight' Official Trailer starring Mark Ruffalo, Michael Keaton and Rachel McAdams",https://www.youtube.com/watch?v=rfm_wJFerfA,,1870.0,363.0,1438186926.0,Trailers,Spotlight
41,10vnl9n,Whatever happened to Neill Blomkamp?,https://www.reddit.com/r/movies/comments/10vnl9n/whatever_happened_to_neill_blomkamp/,"I thought he was going to be the next big thing when it comes to directors.

After District 9 (not seen this one), Elysuim (thought this was good) and Chappie (it was ok) - according to IMDB he only did short films for years until last year.

If he's got ""sidelined"" by Hollywood do you think its got anything to do the with concept art that he did for alien without the studio's permission, I heard they weren't too happy about that.

Edit - looks like a lot of people seem to have a hard time with me not seeing D9 and don't understand why I would post such a question without seeing it - the answer to that is easy, seen the trailers and clips, it didn't like the look of it, but the overwhelming view is that it's regarded as a good film.",228.0,417.0,1675730865.0,Discussion,Chappie
42,xupkgi,So it's thank to focus groups why trailers spoil too much.,https://www.reddit.com/r/movies/comments/xupkgi/so_its_thank_to_focus_groups_why_trailers_spoil/,"At first I thought it's mainly studios doing it to garner as much interest as possible. Turns out it's mainly focus groups who prefer trailers that spoil everything vs trailers that don't.

Amazing! Sad too. At the end of the day it really is the audience that wants to be spoiled as much as possible.",70.0,103.0,1664817636.0,Discussion,Focus
43,3gje9v,Columbia Pictures copyright claim results in own Pixels trailer being taken down,http://www.geek.com/news/columbia-pictures-copyright-claim-results-in-own-pixels-trailer-being-taken-down-1630694/,,11393.0,692.0,1439257168.0,Article,Pixels
44,y7axg5,Creed III | Official Trailer,https://www.youtube.com/watch?v=AHmCH7iB_IM,,2656.0,855.0,1666108756.0,Trailer,Creed
45,gzmp8x,"""Bill and Ted Face the Music"" (2020) Trailer",https://youtu.be/0hAL7emClFM,,15112.0,1165.0,1591707711.0,Trailers,Ted 2
46,2mrsmb,Disney's Cinderella - Official US Trailer,https://www.youtube.com/watch?v=20DF6U1HcGQ,,353.0,307.0,1416406869.0,Trailers,Cinderella
47,2ygpx8,New 'Tomorrowland' trailer. Starring George Clooney. Directed by Brad Bird.,https://www.youtube.com/watch?v=AjBLszpEk0o,,2580.0,553.0,1425924117.0,Trailers,Tomorrowland
48,j3v006,The Witches - Official Trailer,https://www.youtube.com/watch?v=9nlhmJF5FNI,,1270.0,531.0,1601647279.0,,The Witch
49,38om5t,'Bridge of Spies' Official Movie Trailer starring Tom Hanks,https://www.youtube.com/watch?v=Ng7wZLJgdCw,,1972.0,403.0,1433519941.0,Trailers,Bridge of Spies
50,1si8s4,"First trailer for The Wachowskis’ ‘Jupiter Ascending’ (Starring Mila Kunis, Channing Tatum & Sean Bean)",http://www.youtube.com/watch?v=ZoCyL_Pqzu8,,2070.0,941.0,1386635433.0,,Jupiter Ascending
51,1b3vpe,The Wolverine: International Trailer,http://www.youtube.com/watch?v=WEbzZP-_Ssc,,2230.0,1497.0,1364389628.0,,The Intern
52,we3mxs,The ending of The Age of Adaline made me actively angry (SPOILERS),https://www.reddit.com/r/movies/comments/we3mxs/the_ending_of_the_age_of_adaline_made_me_actively/,"This whole post is a spoiler for the end of the movie. Do not read if you plan to see the movie.

Netflix just added The Age of Adaline, and the premise seemed really interesting. The plot is basically as follows; one woman becomes immortal through a scientific fluke (car accident with funky weather conditions in a lake with lightning), and has spent the last hundred or so years with a physical age of 28 years old. At one point the government gets wise to the fact she doesn't age, and after a close encounter Adaline adopted a policy of changing her identity every decade. Beyond that, it's a classic boy-meets-girl story but with the whole novel immortality twist.

I wanted good writing, and I wanted deep thinking about what someone in her situation would do. I wanted them to build a believable world, given their premise. And they did it! The beginning of the movie was excellent, and was everything I was hoping for when I read the synopsis. I loved how the character felt wise and old beyond her years, I loved how she became friends with blind people so that she could maintain friendships for longer than the lifespan of her alias'. The meet-cute part wasn't bad either, and I enjoyed the conflict Adaline felt between her situation and her attraction for the lead guy. I quite enjoyed the fact she had loved and left his father in the past, made for an interesting ""getting to meet the parents"" dynamic and really let the premise of this world naturally carry the story behind it. She just wants to grow old with someone and not have heartbreak every time she outlives them, yet she can't or she will  end up as a lab specimen for the remainder of her immortal life. Brilliant idea well executed.

**And then they ruined it.**

She ran away, as she did in the past, and decided to turn around this time and risk letting people know and trying to live out this life - so she stops by the side of a lake while there are funky weather conditions and her love interest crashes into her car while racing back to stop her from leaving. Suddenly she can get old again! HOORAY!

**Fuck you.**

The entire thing that made this movie interesting was that its main character had to make difficult choices, grapple with the real problems that came with her immortality, come up with interesting thought provoking solutions to something I hadn't considered much prior to this. Throwing all of that away so there could be a fucking fairytale *""and they lived happily ever after""* perfect fuckin' happy ending is **bullshit**. *""Oh thank god everything worked out so perfectly!""* Dammit, the beauty of this story WAS THE PROBLEMS! Hell, you could even have just had her decide to face her problems so she can get with the guy, and then fade to black. Roll credits. Fine. I get that stories have to end. But they could have had the fuckin' *""meet and kiss in the rain""* ending while still keeping the heart of the story alive - they didn't have to ruin the whole fucking premise by bending the arc of plot inevitability to force a perfect ending. 

A perfect ending would have been Adaline confessing her unaging reality to her super rich boyfriend, and them together walking off discussing how they can ensure she lives in an increasingly online world, how to keep her safe, how their relationship will work when she almost married his Dad 40 years ago, etc. There was still story left, *fucking interesting story*, and they just... didn't. They threw it all away for the Hallmark Special. Dammit, they also threw away the chance for a sequel! What if every few years we get a new look at Adaline at a different period of time? Have her follow along with modern times? Every time she starts the new decade by leaving the last guy (or outliving him)? Coulda been like a Bond thing. ""Who's gonna be the new Adaline? I really like so-and-so!""

But no. This movie was brimming with potential, yet rather than keep the only thing that separated this movie from every other romcom in the metaphorical $5 movie bin they chucked the entire reason this movie was working to get their happy ending.

Fuck you, J. Mills Goodloe and  and Salvador Paskowitz. Fuck. You.",129.0,108.0,1659419424.0,Spoilers,The Age of Adaline
53,2ppkk2,It Follows TRAILER (2015) Maika Monroe Horror Movie HD,https://www.youtube.com/watch?feature=player_embedded&v=yztWmlvCJeU,,169.0,55.0,1418930233.0,Trailers,It Follows
54,16s4u6c,"David McCallum Dead: Star of 'NCIS,' 'The Man From U.N.C.L.E.' Was 90",https://variety.com/2023/tv/news/david-mccallum-dead-ncis-man-from-uncle-1235734772/,,4442.0,243.0,1695677987.0,News,The Man from U.N.C.L.E.
55,3d9270,Everyone else notice the final 'Fantastic Four' trailer has changed everything from orange/red to green? Anyone know why?,http://imgur.com/a/7R0t4,,11793.0,1882.0,1436880431.0,News,Fantastic Four
56,3j7nuk,"The Danish Girl Official Trailer #1 (2015) - Eddie Redmayne, Alicia Vikander Drama HD",https://www.youtube.com/watch?v=d88APYIGkjk,,1165.0,488.0,1441110448.0,Trailers,The Danish Girl
57,3a2m1c,First Official Look at Nick Offerman and his wife Megan Mullally's characters in 'Hotel Transylvania 2',http://i.imgur.com/mfnl2cy.jpg,,9203.0,525.0,1434481762.0,Media,Hotel Transylvania 2
58,3cjxi3,'Southpaw' - Official Final Trailer,https://www.youtube.com/watch?v=brbypndEJLk,,58.0,38.0,1436365276.0,Trailers,Southpaw
59,3e334i,The Good Dinosaur - Trailer,http://youtu.be/O-RgquKVTPE,,3150.0,1090.0,1437495141.0,Trailers,The Good Dinosaur
60,2mvknt,Pitch perfect 2 Trailer - 2015,http://youtu.be/KBwOYQd21TY,,2931.0,661.0,1416492858.0,,Pitch Perfect 2
61,av2r2x,Topher Grace edited all 10 Star Wars movies into one super trailer called “Star Wars: Always” when his wife was out of town for a weekend,https://www.youtube.com/watch?v=JdoWJywrOuw&feature=youtu.be,,51754.0,2564.0,1551205792.0,,Paper Towns
62,2vse37,"CRIMSON PEAK Trailer #1 (2015) Tom Hiddleston, Jessica Chastain. Directed by Guillermo Del Toro.",https://www.youtube.com/watch?v=j3_gvBTjUhY,,5819.0,935.0,1423850900.0,Trailers,Crimson Peak
63,38ixu1,"Everest - Official Trailer (Jason Clarke, Josh Brolin, John Hawkes, Jake Gyllenhaal)",https://www.youtube.com/watch?v=5ZQVpPiOji0,,768.0,440.0,1433430189.0,Trailers,Everest
64,33hezz,Another new Poster for M. Night Shyamalan's 'The Visit'; First Trailer debuts online tomorrow,http://i.imgur.com/XQYKhTe.jpg,,1662.0,508.0,1429716345.0,Poster,The Visit
65,an5ihb,‘The Haunting of Sharon Tate’ Official Trailer - Hillary Duff,https://youtu.be/R9JFD50C83Y,,7.0,7.0,1549309949.0,Trailers,The DUFF
66,36b2ih,STEVE JOBS - Teaser Trailer,https://www.youtube.com/watch?v=kCNuTXGmToY,,977.0,839.0,1431902574.0,Trailers,Steve Jobs
67,3ddkq6,First Official Trailer for David O. Russell's 'Joy' starring Jennifer Lawrence and Bradley Cooper,https://www.youtube.com/watch?v=SN4MLMHET7w,,4881.0,1826.0,1436965194.0,Trailers,Joy
68,2oxjbt,Eerie poster for In the Heart of the Sea,https://i.imgur.com/2syPV5w.jpg?1,,16564.0,1222.0,1418264756.0,Poster,In the Heart of the Sea
69,qvnmcu,SPIDER-MAN: NO WAY HOME - Official Trailer,https://www.youtube.com/watch?v=JfVOs4VSpmA,,37711.0,5734.0,1637112612.0,Trailers,Home
70,37yjr0,Straight Outta Compton Trailer #2,https://www.youtube.com/watch?v=K3-7cYbwUXw,,5357.0,887.0,1433081518.0,Trailers,Straight Outta Compton
71,3dho6i,Tom Hardy in new 'Legend' trailer,https://www.youtube.com/watch?v=ey7S4hko_Mc,,8382.0,1136.0,1437042480.0,Trailers,Legend
72,3ckamz,'Goosebumps' Official Full-Length Trailer,https://www.youtube.com/watch?v=7Cn716jv61s,,6399.0,1633.0,1436371212.0,Trailers,Goosebumps
73,oopefe,Vacation Friends (2021) Red Band Trailer.,https://youtu.be/1cKWKyh6d1k,,92.0,56.0,1626872460.0,Trailers,Vacation
74,yrfugq,Scrooge: A Christmas Carol | Official Trailer | Netflix,https://www.youtube.com/watch?v=tZylTiyaWV8,,4.0,33.0,1668088841.0,Trailer,Carol
75,34bbi5,‘The Last Witch Hunter’ Official Teaser Trailer (2015) | Vin Diesel Movie,https://www.youtube.com/watch?v=sQaYwtJTIhk,,904.0,302.0,1430337693.0,Trailers,The Last Witch Hunter
76,3ild33,Burnt | official trailer (2015) Bradley Cooper,https://www.youtube.com/watch?v=nRMX0q4e1Eo,,202.0,167.0,1440680128.0,Trailers,Burnt
77,b3ro31,John Wick Chapter 3 Official Trailer,https://youtu.be/pU8-7BX9uxs,,40354.0,2806.0,1553181099.0,Trailers,Insidious: Chapter 3
78,36xwh1,Black Mass - Official Trailer #2 (starring Johnny Depp),https://www.youtube.com/watch?v=YJWJeBJnT6M,,2385.0,410.0,1432343053.0,Trailers,Black Mass
79,4p3tat,The Girl with All The Gifts – Official Trailer,https://youtu.be/HjGkB_oWTe0,,143.0,52.0,1466502428.0,Trailers,The Gift
80,38jgs2,THE WALK - Official Trailer (Joseph Gordon-Levitt),https://www.youtube.com/watch?v=GR1EmTKAWIw,,285.0,135.0,1433437370.0,Trailers,The Walk
81,2a1u9l,The Longest Film Ever Made Receives 72-Minute Trailer,http://thefilmstage.com/trailer/the-longest-film-ever-made-receives-72-minute-trailer/,,461.0,252.0,1404743590.0,,The Longest Ride
82,3j3n1j,New Full-Length Trailer for Eli Roth's 'Knock Knock' starring Keanu Reeves,https://www.youtube.com/watch?v=-6_ja3wdSTE,,1416.0,613.0,1441037907.0,Trailers,Knock Knock
83,2xx5fd,"Self/less Official Trailer (2015) - Ryan Reynolds, Ben Kingsley Sci-Fi Movie",https://www.youtube.com/watch?v=3agaVwt0tb8,,1353.0,193.0,1425486842.0,Trailers,Self/less
84,2vjf5i,HITMAN: AGENT 47 trailer - YouTube,https://www.youtube.com/watch?v=gzxyH9x7rks,,6665.0,2510.0,1423665883.0,Trailers,Hitman: Agent 47
85,2rvc5p,Run All Night Official Trailer #1 (2015) - Liam Neeson Action Movie HD,https://www.youtube.com/watch?v=7uDuFh-nC-c,,49.0,57.0,1420821688.0,Trailers,Run All Night
86,hkloow,An American Pickle | Official Trailer | HBO Max,https://www.youtube.com/watch?v=JBC0pTh6GDM,,11985.0,740.0,1593792271.0,,American Ultra
87,2ndx7e,Pan - Official Trailer [HD],http://youtu.be/tjW1mKwNUSo,,2095.0,663.0,1416934881.0,Trailers,Pan
88,11mujb1,No Hard Feelings - Official Trailer,https://youtu.be/IEtNl-DNC8E,,3039.0,1180.0,1678374394.0,Trailer,Get Hard
89,2dcgu5,"MORTDECAI - Official Trailer (2015) [HD] Johnny Depp, Gwyneth Paltrow",https://www.youtube.com/watch?v=UcbQcCWVq1U&feature=player_detailpage,,28.0,53.0,1407860167.0,,Mortdecai
90,2vjxdq,TRAINWRECK Trailer #1 (2015) Judd Apatow Comedy Movie HD,https://www.youtube.com/watch?v=lrwsY2JxWM8,,629.0,316.0,1423674839.0,Trailers,Trainwreck
91,255ydt,The Akira Project - Live Action Trailer,http://youtu.be/t1GO-93Nt3c,,2911.0,1439.0,1399674332.0,,Project Almanac
92,31w69z,Me And Earl And The Dying Girl - Official HD Trailer (Winner of the Grand Jury Prize and the Audience Award at the 2015 Sundance Film Festival),https://www.youtube.com/watch?v=2qfmAllbYC8,,2609.0,255.0,1428512819.0,Trailers,Me and Earl and the Dying Girl
93,3t83j5,'Concussion' - Official International Trailer (starring Will Smith),https://www.youtube.com/watch?v=oYGt8Cy_nUc,,58.0,31.0,1447803327.0,Trailers,Concussion
94,3b7x99,No Escape Official Trailer #2 (2015) Owen Wilson Thriller Movie HD,https://www.youtube.com/watch?v=4wOLEH99ob4,,198.0,116.0,1435342302.0,Trailers,No Escape
95,1ablm7l,Monkey Man | Official Trailer,https://www.youtube.com/watch?v=g8zxiB5Qhsc,,6420.0,1209.0,1706284761.0,Trailer,Irrational Man
96,456ntb,'Hardcore Henry' Official Trailer #1 (POV action movie),https://www.youtube.com/watch?v=96EChBYVFhU,,3151.0,489.0,1455159318.0,Trailers,Hardcore Henry
97,dw9wj6,The SpongeBob Movie: Sponge on the Run (2020) - Official Trailer - Paramount Pictures,https://www.youtube.com/watch?v=HfiH_526qhY,,20600.0,1401.0,1573740016.0,,The SpongeBob Movie: Sponge Out of Water
98,36mgef,First trailer We Are Your Friends with Zac Efron,https://www.youtube.com/watch?v=3uv5Xzm--ho&feature=youtu.be,,0.0,3.0,1432129210.0,Trailers,We Are Your Friends
99,c1qpge,"""Descendants 3"" Official trailer",https://www.youtube.com/watch?v=8jpvcD_LkK4,,0.0,2.0,1560793955.0,,Descendants
100,2uvxm1,"Official First Trailer for the ""POLTERGEIST"" Remake - starring Sam Rockwell",https://www.youtube.com/watch?v=YCmAaNk_iIQ,,772.0,448.0,1423155472.0,Trailers,Poltergeist
101,37e0ch,Point Break - Official Trailer [HD],https://www.youtube.com/watch?v=ncvFAm4kYCo,,636.0,771.0,1432681228.0,Trailers,Point Break
102,3fwl74,Solace Trailer: Colin Farrell and Anthony Hopkins are Warring Psychics,https://www.youtube.com/watch?v=G6V1HLxwQDY,,93.0,38.0,1438798963.0,,Solace
103,446eyf,'Demolition' - Official Trailer #2 (starring Jake Gyllenhaal),https://www.youtube.com/watch?v=3UnSXelOJo0,,639.0,180.0,1454608453.0,Trailers,Demolition
104,3k8jhu,Krampus - Official Trailer (HD),https://www.youtube.com/watch?v=h6cVyoMH4QE,,7819.0,1525.0,1441803652.0,Trailers,Krampus
105,3hfxav,Victor Frankenstein - Official Trailer.,https://www.youtube.com/watch?v=7pxZxY_Siyc,,5470.0,1362.0,1439903301.0,Trailers,Victor Frankenstein
106,12bnhom,Barbie | Teaser Trailer 2,https://www.youtube.com/watch?v=GRyt3Ov4zz0,,19230.0,2116.0,1680624030.0,Trailer,Sinister 2
107,jyozbo,Who liked Bone Tomahawk?,https://www.reddit.com/r/movies/comments/jyozbo/who_liked_bone_tomahawk/,"Did anyone else love Bone Tomahawk?

I’ve seen it so many times and it never gets old. Matthew Fox drove me nuts in Party of Five and Lost but he killed it in this movie. Kurt Russell was made for Westerns so I don’t even need to mention him. 

I don’t know. It was such a sleeper movie, and I recommend it to anyone that loves gore.",1646.0,502.0,1606016930.0,Discussion,Bone Tomahawk
108,c7sa35,JUMANJI: THE NEXT LEVEL - Official Trailer (HD),https://www.youtube.com/watch?v=rBxcF-r9Ibs,,30376.0,2097.0,1561986031.0,Trailers,The Boy Next Door
109,2hg7uj,Chris Hemsworth Is a Hacker in Michael Mann's Blackhat (Trailer),https://www.youtube.com/watch?v=Q1HO07bKGhU,,125.0,159.0,1411667833.0,Trailers,Blackhat
110,2vljmz,"ALOHA Trailer, directed by Cameron Crowe",http://youtu.be/kZyEAiQuHss,,251.0,140.0,1423701086.0,Trailers,Aloha
111,b2wz81,Toy Story 4 | Official Trailer,https://youtu.be/wmiIUN-7qhE,,39394.0,3966.0,1552999579.0,Trailers,True Story
112,67e3n1,Kingsman: The Golden Circle | Official Trailer,https://www.youtube.com/watch?v=6Nxc-3WpMbg,,33082.0,2753.0,1493091028.0,Trailers,Circle
113,3kwx1w,"Colonia movie trailer Staring Emma Watson,Daniel Bruhl",https://www.youtube.com/watch?v=n9tpFVlm1pA,,141.0,90.0,1442241265.0,Trailers,Colonia
114,3o7qak,The new poster for Scouts Guide to the Zombie Apocalypse is beautiful,http://oyster.ignimgs.com/wordpress/stg.ign.com/2015/10/SVZ_ONLINE_1sht-720x1111.jpg,,12271.0,1264.0,1444481743.0,Poster,Scouts Guide to the Zombie Apocalypse
